{
  "format": "mathos-test-field",
  "version": 1,
  "name": "Feeding test",
  "seed": 42,
  "world": {
    "width": 32,
    "height": 24
  },
  "rules": {
    "foodEnergy": 24,
    "sunlight": 2,
    "upkeep": 1
  },
  "organisms": {
    "startingEnergy": 120,
    "learning": true,
    "structuralMutation": false
  },
  "test": {
    "preset": "feeding",
    "steps": 200
  }
}
